{
  "app": "izumi",
  "kind": "theme-release",
  "schemaVersion": 1,
  "release": {
    "id": "izumi.marigold",
    "name": "Marigold",
    "version": "1.0.3",
    "author": "Izumi",
    "description": "KickAssAnime look: black and Material yellow in Roboto, a pinned side menu, year-chip poster grid, today's releases.",
    "themeApi": 5,
    "tags": [
      "Dark",
      "Site",
      "Top bar",
      "Docked player"
    ],
    "platforms": [
      "desktop",
      "phone"
    ],
    "project": "https://github.com/nickEatsBread/izumi-themes",
    "download": "https://raw.githubusercontent.com/nickEatsBread/izumi-themes/main/packages/izumi.marigold/1.0.3.json",
    "sha256": "d071211d3ab5b08615defc4a7ee3f9d61908cc7914bdd34b56385afc0dfeca6a",
    "bytes": 39517,
    "preview": "https://raw.githubusercontent.com/nickEatsBread/izumi-themes/main/previews/izumi.marigold/desktop-home.jpg",
    "screenshots": [
      {
        "screen": "home",
        "platform": "desktop",
        "url": "https://raw.githubusercontent.com/nickEatsBread/izumi-themes/main/previews/izumi.marigold/desktop-home.jpg"
      },
      {
        "screen": "series",
        "platform": "desktop",
        "url": "https://raw.githubusercontent.com/nickEatsBread/izumi-themes/main/previews/izumi.marigold/desktop-series.jpg"
      },
      {
        "screen": "search",
        "platform": "desktop",
        "url": "https://raw.githubusercontent.com/nickEatsBread/izumi-themes/main/previews/izumi.marigold/desktop-search.jpg"
      },
      {
        "screen": "schedule",
        "platform": "desktop",
        "url": "https://raw.githubusercontent.com/nickEatsBread/izumi-themes/main/previews/izumi.marigold/desktop-schedule.jpg"
      },
      {
        "screen": "home",
        "platform": "phone",
        "url": "https://raw.githubusercontent.com/nickEatsBread/izumi-themes/main/previews/izumi.marigold/phone-home.jpg"
      },
      {
        "screen": "series",
        "platform": "phone",
        "url": "https://raw.githubusercontent.com/nickEatsBread/izumi-themes/main/previews/izumi.marigold/phone-series.jpg"
      },
      {
        "screen": "search",
        "platform": "phone",
        "url": "https://raw.githubusercontent.com/nickEatsBread/izumi-themes/main/previews/izumi.marigold/phone-search.jpg"
      }
    ]
  }
}
