{
  "app": "izumi",
  "kind": "theme-release",
  "schemaVersion": 1,
  "release": {
    "id": "izumi.reel",
    "name": "Reel",
    "version": "2.0.2",
    "author": "Izumi",
    "description": "animepahe look: black and magenta, a text-link header, a latest-releases grid, its player page with the settings bar.",
    "themeApi": 5,
    "tags": [
      "Dark",
      "Site",
      "Grid",
      "Docked player"
    ],
    "platforms": [
      "desktop",
      "phone"
    ],
    "project": "https://github.com/nickEatsBread/izumi-themes",
    "download": "https://raw.githubusercontent.com/nickEatsBread/izumi-themes/main/packages/izumi.reel/2.0.2.json",
    "sha256": "5842a4972ed87d588606b54e6b58d52ab4b3c674eb6aa9f91f2e821ca7ceb4f7",
    "bytes": 22396,
    "preview": "https://raw.githubusercontent.com/nickEatsBread/izumi-themes/main/previews/izumi.reel.png"
  }
}
