{
  "app": "izumi",
  "kind": "theme-release",
  "schemaVersion": 1,
  "release": {
    "id": "izumi.onyx",
    "name": "Onyx",
    "version": "2.0.3",
    "author": "Izumi",
    "description": "Nuvio look: white on near-black, a full-bleed hero with a View details pill, a floating pill nav, stadium buttons.",
    "themeApi": 5,
    "tags": [
      "Phone",
      "Dark",
      "App",
      "Monochrome"
    ],
    "platforms": [
      "phone",
      "desktop"
    ],
    "project": "https://github.com/nickEatsBread/izumi-themes",
    "download": "https://raw.githubusercontent.com/nickEatsBread/izumi-themes/main/packages/izumi.onyx/2.0.3.json",
    "sha256": "43a470348f2fc6f3406b441493f54abcda62ffcd42261daea924747edc02b068",
    "bytes": 124939,
    "preview": "https://raw.githubusercontent.com/nickEatsBread/izumi-themes/main/previews/izumi.onyx.png"
  }
}
