{
  "app": "izumi",
  "kind": "theme-release",
  "schemaVersion": 1,
  "release": {
    "id": "izumi.saffron",
    "name": "Saffron",
    "version": "1.0.1",
    "author": "Izumi",
    "description": "Crunchyroll look: black and orange DM Sans, a key-art carousel with title logos, a Categories menu and episode grids.",
    "themeApi": 5,
    "tags": [
      "Dark",
      "Site",
      "Top bar"
    ],
    "platforms": [
      "desktop",
      "phone"
    ],
    "project": "https://github.com/nickEatsBread/izumi-themes",
    "download": "https://raw.githubusercontent.com/nickEatsBread/izumi-themes/main/packages/izumi.saffron/1.0.1.json",
    "sha256": "bb2a95fe3041214173fc4768c00ed8d2becfbc1501800bd64cb95d2258747b3d",
    "bytes": 70084,
    "preview": "https://raw.githubusercontent.com/nickEatsBread/izumi-themes/main/previews/izumi.saffron.png"
  }
}
