{
  "app": "izumi",
  "kind": "theme-release",
  "schemaVersion": 1,
  "release": {
    "id": "izumi.spotlight",
    "name": "Spotlight",
    "version": "2.0.3",
    "author": "Izumi",
    "description": "Anikoto look: navy and sky blue in Nunito, a full-width hero with Play now, sub-count posters, Top anime aside.",
    "themeApi": 5,
    "tags": [
      "Dark",
      "Site",
      "Top bar",
      "Docked player"
    ],
    "platforms": [
      "desktop",
      "phone"
    ],
    "project": "https://github.com/nickEatsBread/izumi-themes",
    "download": "https://raw.githubusercontent.com/nickEatsBread/izumi-themes/main/packages/izumi.spotlight/2.0.3.json",
    "sha256": "00cbc5675f16289b95aa7db6a06c1b30a53c4fe6e3c6b3446b1fae21bd463856",
    "bytes": 66840,
    "preview": "https://raw.githubusercontent.com/nickEatsBread/izumi-themes/main/previews/izumi.spotlight.png"
  }
}
