{
  "app": "izumi",
  "kind": "theme-release",
  "schemaVersion": 1,
  "release": {
    "id": "izumi.nebula",
    "name": "Nebula",
    "version": "1.0.0",
    "author": "Izumi",
    "description": "A deep violet-navy canvas with a soft mesh glow and a bright violet accent. Compact icon rail, a wide featured backdrop with pill actions, rounded poster rows with quiet titles, and a full-bleed series page whose episodes run as a thumbnail list beneath the artwork.",
    "themeApi": 2,
    "tags": [
      "Dark",
      "Mesh",
      "Overlay series"
    ],
    "platforms": [
      "desktop",
      "phone"
    ],
    "project": "https://github.com/nickEatsBread/izumi-themes",
    "download": "https://raw.githubusercontent.com/nickEatsBread/izumi-themes/main/packages/izumi.nebula/1.0.0.json",
    "sha256": "5141b5f1bf006ca3f5b1afc42fd7c3491e790d6a9e86c98dcae3dc086e45ec81",
    "bytes": 14300,
    "preview": "https://raw.githubusercontent.com/nickEatsBread/izumi-themes/main/previews/izumi.nebula.png"
  }
}
