{
  "app": "izumi",
  "kind": "theme-release",
  "schemaVersion": 1,
  "release": {
    "id": "izumi.iris",
    "name": "Iris",
    "version": "1.0.3",
    "author": "Izumi",
    "description": "Senshi look: near-black and purple, a full-bleed hero under a clear header, overlay poster rails, medal-ranked trending.",
    "themeApi": 5,
    "tags": [
      "Dark",
      "Site",
      "Top bar",
      "Docked player"
    ],
    "platforms": [
      "desktop",
      "phone"
    ],
    "project": "https://github.com/nickEatsBread/izumi-themes",
    "download": "https://raw.githubusercontent.com/nickEatsBread/izumi-themes/main/packages/izumi.iris/1.0.3.json",
    "sha256": "bc9765579fb28b802077625b376f4ef8a811f2e3eddb81c56bab0d642622d685",
    "bytes": 75151,
    "preview": "https://raw.githubusercontent.com/nickEatsBread/izumi-themes/main/previews/izumi.iris.png"
  }
}
