{
  "app": "izumi",
  "kind": "theme-release",
  "schemaVersion": 1,
  "release": {
    "id": "izumi.ink",
    "name": "Ink",
    "version": "1.0.0",
    "author": "Izumi",
    "description": "A quiet, compact browsing layout with no hero and a wrapping poster grid. Continue Watching keeps its carousel.",
    "themeApi": 1,
    "tags": [
      "Dark",
      "Compact",
      "Grid"
    ],
    "preview": "https://raw.githubusercontent.com/nickEatsBread/izumi-themes/main/previews/izumi.ink.png",
    "project": "https://github.com/nickEatsBread/izumi-themes",
    "download": "https://raw.githubusercontent.com/nickEatsBread/izumi-themes/main/packages/izumi.ink/1.0.0.json",
    "sha256": "15d10292121f19a036a387b1034a1ce80640f0ff2c708b3b4388a37a6ad61d91",
    "bytes": 1487
  }
}
