{
  "app": "izumi",
  "kind": "theme-release",
  "schemaVersion": 1,
  "release": {
    "id": "izumi.lavender",
    "name": "Lavender",
    "version": "2.0.3",
    "author": "Izumi",
    "description": "anilili look: black and purple, genre chips over a full-bleed hero, segmented tabs, ★ score badges, pill tabs.",
    "themeApi": 5,
    "tags": [
      "Phone",
      "Dark",
      "App",
      "Material"
    ],
    "platforms": [
      "phone",
      "desktop"
    ],
    "project": "https://github.com/nickEatsBread/izumi-themes",
    "download": "https://raw.githubusercontent.com/nickEatsBread/izumi-themes/main/packages/izumi.lavender/2.0.3.json",
    "sha256": "d8a24751918fd284b2936040e8dab63e8d944f1aada908ce6bb4839e383be94f",
    "bytes": 184627,
    "preview": "https://raw.githubusercontent.com/nickEatsBread/izumi-themes/main/previews/izumi.lavender.png"
  }
}
