{
  "app": "izumi",
  "kind": "theme-release",
  "schemaVersion": 1,
  "release": {
    "id": "izumi.cinema",
    "name": "Cinema",
    "version": "1.0.0",
    "author": "Izumi",
    "description": "The familiar hero with a bold top-ten rank treatment, softer artwork corners and spacious rows.",
    "themeApi": 1,
    "tags": [
      "Dark",
      "Rank badge",
      "Spacious"
    ],
    "preview": "https://raw.githubusercontent.com/nickEatsBread/izumi-themes/main/previews/izumi.cinema.png",
    "project": "https://github.com/nickEatsBread/izumi-themes",
    "download": "https://raw.githubusercontent.com/nickEatsBread/izumi-themes/main/packages/izumi.cinema/1.0.0.json",
    "sha256": "3f27e76d09af37222842e7380d80ec2adc01dd8b2a3c0a333221ed0bdd8c5cff",
    "bytes": 2586
  }
}
