{
  "app": "izumi",
  "kind": "theme-release",
  "schemaVersion": 1,
  "release": {
    "id": "izumi.frost",
    "name": "Frost",
    "version": "2.0.2",
    "author": "Izumi",
    "description": "MKissa look: pure black in Inter, a labelled side rail, big poster cards with episode footers, orange ranks.",
    "themeApi": 5,
    "tags": [
      "Dark",
      "Site",
      "Side rail",
      "Docked player"
    ],
    "platforms": [
      "desktop",
      "phone"
    ],
    "project": "https://github.com/nickEatsBread/izumi-themes",
    "download": "https://raw.githubusercontent.com/nickEatsBread/izumi-themes/main/packages/izumi.frost/2.0.2.json",
    "sha256": "cff557a22de9ec77af676951267dbd63dd03d17b74a65aae6eed5d47bf9e6bc6",
    "bytes": 56356,
    "preview": "https://raw.githubusercontent.com/nickEatsBread/izumi-themes/main/previews/izumi.frost.png"
  }
}
