{
  "app": "izumi",
  "kind": "theme-release",
  "schemaVersion": 1,
  "release": {
    "id": "izumi.ember",
    "name": "Ember",
    "version": "1.2.0",
    "author": "Izumi",
    "description": "A warm crimson living-room palette: tinted cards, a red accent, landscape resume art and the same split episode rail as Tidal.",
    "themeApi": 1,
    "tags": [
      "Dark",
      "Overlay",
      "Landscape"
    ],
    "project": "https://github.com/nickEatsBread/izumi-themes",
    "download": "https://raw.githubusercontent.com/nickEatsBread/izumi-themes/main/packages/izumi.ember/1.2.0.json",
    "sha256": "d25291b4b03f592f627d38c1d97d526637967d0ccde8adb71884050921212162",
    "bytes": 6012,
    "preview": "https://raw.githubusercontent.com/nickEatsBread/izumi-themes/main/previews/izumi.ember.png"
  }
}
