{
  "app": "izumi",
  "kind": "theme-release",
  "schemaVersion": 1,
  "release": {
    "id": "izumi.carbon",
    "name": "Carbon",
    "version": "1.0.5",
    "author": "Izumi",
    "description": "Anime Nexus look: zinc in DM Sans, a centred logo, a light Watch now, corner-badged episodes, a popular list.",
    "themeApi": 5,
    "tags": [
      "Dark",
      "Site",
      "Top bar",
      "Docked player"
    ],
    "platforms": [
      "desktop",
      "phone"
    ],
    "project": "https://github.com/nickEatsBread/izumi-themes",
    "download": "https://raw.githubusercontent.com/nickEatsBread/izumi-themes/main/packages/izumi.carbon/1.0.5.json",
    "sha256": "290ab075b0c06e6ae50cc87840a1e75ea1abf61f11bb8620053cba648d964e7a",
    "bytes": 59650,
    "preview": "https://raw.githubusercontent.com/nickEatsBread/izumi-themes/main/previews/izumi.carbon/desktop-home.jpg",
    "screenshots": [
      {
        "screen": "home",
        "platform": "desktop",
        "url": "https://raw.githubusercontent.com/nickEatsBread/izumi-themes/main/previews/izumi.carbon/desktop-home.jpg"
      },
      {
        "screen": "series",
        "platform": "desktop",
        "url": "https://raw.githubusercontent.com/nickEatsBread/izumi-themes/main/previews/izumi.carbon/desktop-series.jpg"
      },
      {
        "screen": "search",
        "platform": "desktop",
        "url": "https://raw.githubusercontent.com/nickEatsBread/izumi-themes/main/previews/izumi.carbon/desktop-search.jpg"
      },
      {
        "screen": "schedule",
        "platform": "desktop",
        "url": "https://raw.githubusercontent.com/nickEatsBread/izumi-themes/main/previews/izumi.carbon/desktop-schedule.jpg"
      },
      {
        "screen": "home",
        "platform": "phone",
        "url": "https://raw.githubusercontent.com/nickEatsBread/izumi-themes/main/previews/izumi.carbon/phone-home.jpg"
      },
      {
        "screen": "series",
        "platform": "phone",
        "url": "https://raw.githubusercontent.com/nickEatsBread/izumi-themes/main/previews/izumi.carbon/phone-series.jpg"
      },
      {
        "screen": "search",
        "platform": "phone",
        "url": "https://raw.githubusercontent.com/nickEatsBread/izumi-themes/main/previews/izumi.carbon/phone-search.jpg"
      }
    ]
  }
}
